{
  "$schema": "../../../schema/recipe.schema.json",
  "schema_version": 1,
  "id": "vllm/qwen38-flash-next-nvfp4",
  "title": "Qwen3.8 Flash Next NVFP4 (vLLM, single GB10)",
  "summary": "vLLM server for RadixArk NVFP4 on one DGX Spark with PLE CPU offload, MTP speculation and tool calling.",
  "runtime": "vllm",
  "model": {
    "repository": "RadixArk/Qwen3.8-Flash-Next-NVFP4",
    "revision": "7b719225242aacd3dbd3f9407468c2ee9a9d2594"
  },
  "hardware": {
    "target": "NVIDIA DGX Spark",
    "gpu": "GB10"
  },
  "entrypoint": "run.sh",
  "status": "draft",
  "tested_at": null
}
